{
  "acceptance": {
    "all_runs_succeeded": true,
    "event_count_exact": true,
    "lifecycle_projection_exact": true,
    "zero_external_services": true
  },
  "environment": {
    "external_services": 0,
    "machine": "x86_64",
    "platform": "Linux",
    "python_implementation": "CPython",
    "python_version": "3.14.6"
  },
  "measurement": {
    "attempts_per_run": 1,
    "events_per_run": 3,
    "max_total_ms": 12.031341,
    "p50_total_ms": 7.660796,
    "p95_total_ms": 10.610762,
    "promotion_records_per_run": 2,
    "samples": 40,
    "successful_runs": 40
  },
  "observed_at": "2026-08-14T08:35:00+08:00",
  "provenance": {
    "benchmark_sha256": "49c230cf09febeebb4774cc318af55a9cffb0f8ef79028aa694c5cf5d92ab3e5",
    "fixture_sha256": "693a75b9c1bd0fa9aa55cd34e61dda51237e429b4516289818beeecb9aa19aed",
    "implementation_sha256": "633da214297ae8c1c933245d8fc09a2217f10fa53dbd13b2cfbfc7346d59c6e6",
    "state_events_sha256": "c32887ebf8fa77caad2bbb12e08b7d5bfebbf46f559dcdae399c6a36954196bc",
    "state_mcp_sha256": "0cf64b480af86c8dff9cd33fa83ba3bb1482bc365c678ea10947584eb16181dc",
    "typed_state_sha256": "f32d08ac4c29dec95a4960470e5a6feffe5fc6507a976efcc745b81ffcbb9de4"
  },
  "schema_version": "context.experiment-lifecycle-benchmark/v1alpha1"
}
